{
  "$schema": "http://json-schema.org/draft-07/schema#",
  "type": "object",
  "additionalProperties": false,
  "required": ["state", "summary", "next_step", "changed_files", "tests", "artifact_path", "blockers"],
  "properties": {
    "state": {"type": "string", "enum": ["working", "needs_input", "blocked", "ready_for_sketchup"]},
    "summary": {"type": "string"},
    "next_step": {"type": "string"},
    "changed_files": {"type": "array", "items": {"type": "string"}},
    "tests": {"type": "array", "items": {"type": "string"}},
    "artifact_path": {"type": ["string", "null"]},
    "blockers": {"type": "array", "items": {"type": "string"}}
  }
}
