{
  "state": "ready_for_sketchup",
  "summary": "Candidata081 corrige preferencias con formato codificado, pruebas de recuperación y permisos excluidos aprobadas en nube.",
  "next_step": "Repetir preference_regression en instalación081 real y cerrar/reabrir SketchUp.",
  "changed_files": [
    "CODEX_STATUS.json",
    "docs/loop-pintado-081/CHANGELOG.md",
    "docs/loop-pintado-081/IMPLEMENTACION_LISTA.md",
    "docs/loop-pintado-081/PROGRESO.md",
    "docs/loop-pintado-081/TAREAS.md",
    "docs/loop-pintado-081/VALIDACION_LOCAL_POSTERIOR.md",
    "docs/loop-pintado-081/verificar_preferencias_sketchup.rb",
    "lib/model.ts",
    "scripts/package-paint-validation.py",
    "sketchup_offline/offline.rb",
    "sketchup_offline/test/smart_controller_test.rb",
    "sketchup_offline/version.json",
    "tests/e2e/dimension-visibility.spec.ts"
  ],
  "tests": [
    "verify exit0:Ruby267/1778,TS119,web16,offline50",
    "Regresión antesfixFAIL/despuésPASS",
    "AuditoríaRBZ19Ruby/JSPASS"
  ],
  "artifact_path": "artifacts/PlanosSanto-0.8.1-candidata.rbz",
  "blockers": [
    "Confirmación nativa del arreglo de preferencias pendiente; sin aprobación global."
  ]
}
