{
  "state": "ready_for_sketchup",
  "summary": "Candidata0.7.4 con biblioteca SKM real, pintado nativo confirmado y pedidos integrados; regresiones nube aprobadas. NO aprobada producción.",
  "next_step": "Instalar RBZ con SketchUp cerrado y ejecutar VALIDACION_LOCAL_POSTERIOR.md con Codex local/Dot sobre copias.",
  "changed_files": [
    ".gitignore",
    "CODEX_STATUS.json",
    "lib/model.ts",
    "planos-santo-loop-pintado-073/PROGRESO.md",
    "planos-santo-loop-pintado-073/TAREAS.md",
    "planos-santo-loop-pintado-073/VALIDACION_LOCAL_POSTERIOR.md",
    "planos-santo-loop-pintado-073/reports/.keep",
    "planos-santo-loop-pintado-073/reports/CHANGELOG.md",
    "planos-santo-loop-pintado-073/reports/GUIA-RUNNER-PINTADO-SKETCHUP.md",
    "planos-santo-loop-pintado-073/reports/IMPLEMENTACION_LISTA.md",
    "planos-santo-loop-pintado-073/reports/validar_pintado_sketchup.rb",
    "scripts/build-offline.mjs",
    "scripts/package-offline-rbz.py",
    "scripts/package-paint-validation.py",
    "scripts/test-offline-ruby.mjs",
    "sketchup_offline/bootstrap.rb",
    "sketchup_offline/material_library.rb",
    "sketchup_offline/material_resolver.rb",
    "sketchup_offline/native_paint.rb",
    "sketchup_offline/ocl_reader.rb",
    "sketchup_offline/offline.rb",
    "sketchup_offline/p1_diagnostics.rb",
    "sketchup_offline/planos_santo.rb",
    "sketchup_offline/supplier_order.rb",
    "sketchup_offline/test/installation_test.rb",
    "sketchup_offline/test/material_library_test.rb",
    "sketchup_offline/test/material_resolver_test.rb",
    "sketchup_offline/test/native_paint_test.rb",
    "sketchup_offline/test/ocl_read_double.rb",
    "sketchup_offline/test/p1_diagnostics_test.rb",
    "sketchup_offline/test/paint_controller_test.rb",
    "sketchup_offline/test/workshop_test.rb",
    "sketchup_offline/ui/App.tsx",
    "sketchup_offline/ui/EdgeReview.tsx",
    "sketchup_offline/ui/MaterialReview.tsx",
    "sketchup_offline/ui/PaintPanel.tsx",
    "sketchup_offline/ui/paint.css",
    "sketchup_offline/version.json",
    "sketchup_offline/workshop.rb",
    "tests/offline/paint.spec.ts"
  ],
  "tests": [
    "npm run verify: exit0; Ruby207/1398; TypeScript119; web16; offline44",
    "unittest paquete:22PASS",
    "auditoría RBZ: CRC/SHA/inventario y17 Ruby/JS PASS",
    "runner SketchUp: solo sintaxis PASS; ejecución nativa NOT_RUN"
  ],
  "artifact_path": "artifacts/PlanosSanto-0.7.4-candidata.rbz",
  "blockers": [
    "Pendiente validación nativa/visual SketchUp2026 y prueba autorizada de importación al proveedor."
  ]
}
