{
  "state": "ready_for_sketchup",
  "summary": "Pintura Inteligente con4modos, paleta y herramienta nativa, lotesUndo y protección de materiales. Automatización nube aprobada.",
  "next_step": "Validar interacción nativa/texturas/Undo en SketchUp2026 sobre copias.",
  "changed_files": [
    "docs/loop-pintado-080/CHANGELOG.md",
    "docs/loop-pintado-080/IMPLEMENTACION_LISTA.md",
    "docs/loop-pintado-080/PROGRESO.md",
    "docs/loop-pintado-080/TAREAS.md",
    "docs/loop-pintado-080/VALIDACION_LOCAL_POSTERIOR.md",
    "lib/model.ts",
    "scripts/build-offline.mjs",
    "scripts/package-offline-rbz.py",
    "scripts/package-paint-validation.py",
    "scripts/test-offline-ruby.mjs",
    "sketchup_offline/bootstrap.rb",
    "sketchup_offline/native_paint.rb",
    "sketchup_offline/offline.rb",
    "sketchup_offline/smart_paint.rb",
    "sketchup_offline/smart_paint_tool.rb",
    "sketchup_offline/test/installation_test.rb",
    "sketchup_offline/test/smart_controller_test.rb",
    "sketchup_offline/test/smart_paint_test.rb",
    "sketchup_offline/test/smart_paint_tool_test.rb",
    "sketchup_offline/ui/App.tsx",
    "sketchup_offline/ui/SmartPaintPalette.tsx",
    "sketchup_offline/ui/smart-paint.css",
    "sketchup_offline/version.json",
    "tests/offline/smart-paint.spec.ts"
  ],
  "tests": [
    "verify exit0:Ruby264/1752,TS119,web16,offline50",
    "Auditoría RBZ19Ruby/JSPASS",
    "Demos A4PASS"
  ],
  "artifact_path": "artifacts/PlanosSanto-0.8.0-candidata.rbz",
  "blockers": [
    "Interacción real SketchUp2026/UV y rendimiento nativo pendientes; no aprobación de producción."
  ]
}
