{
  "state": "ready_for_sketchup",
  "summary": "Ajustes075 de concurrencia, recuperación y cancelación probados en nube;074validada intacta.",
  "next_step": "Validación focalizada local cuando se retome; catálogo/proveedor diferidos.",
  "changed_files": [
    "docs/loop-pintado-075/CHANGELOG.md",
    "docs/loop-pintado-075/IMPLEMENTACION_LISTA.md",
    "docs/loop-pintado-075/PROGRESO.md",
    "docs/loop-pintado-075/TAREAS.md",
    "docs/loop-pintado-075/VALIDACION_LOCAL_POSTERIOR.md",
    "lib/model.ts",
    "scripts/package-paint-validation.py",
    "sketchup_offline/material_library.rb",
    "sketchup_offline/offline.rb",
    "sketchup_offline/test/material_library_test.rb",
    "sketchup_offline/test/paint_controller_test.rb",
    "sketchup_offline/ui/PaintPanel.tsx",
    "sketchup_offline/ui/paint.css",
    "sketchup_offline/version.json",
    "tests/offline/paint.spec.ts"
  ],
  "tests": [
    "verify exit0:Ruby214/1475,TS119,web16,offline47",
    "Auditoría RBZ e integridad074PASS",
    "Demos sintéticas A4PASS"
  ],
  "artifact_path": "artifacts/PlanosSanto-0.7.5-candidata.rbz",
  "blockers": [
    "Validación nativa0.7.5 pendiente; producción no aprobada."
  ]
}
